No.     Time           Source                Destination           Protocol Length Info
      1 0.000000000    192.168.12.9          192.168.11.109        TCP      74     51038 → 5684 [SYN] Seq=0 Win=64240 Len=0 MSS=1460 SACK_PERM=1 TSval=2352695904 TSecr=0 WS=128

Frame 1: 74 bytes on wire (592 bits), 74 bytes captured (592 bits) on interface eth1, id 0
Ethernet II, Src: 02:42:c0:a8:0c:09 (02:42:c0:a8:0c:09), Dst: 02:42:c0:a8:0c:fe (02:42:c0:a8:0c:fe)
Internet Protocol Version 4, Src: 192.168.12.9, Dst: 192.168.11.109
Transmission Control Protocol, Src Port: 51038, Dst Port: 5684, Seq: 0, Len: 0

No.     Time           Source                Destination           Protocol Length Info
      2 0.000098285    192.168.11.109        192.168.12.9          TCP      74     5684 → 51038 [SYN, ACK] Seq=0 Ack=1 Win=65160 Len=0 MSS=1460 SACK_PERM=1 TSval=3413488918 TSecr=2352695904 WS=128

Frame 2: 74 bytes on wire (592 bits), 74 bytes captured (592 bits) on interface eth1, id 0
Ethernet II, Src: 02:42:c0:a8:0c:fe (02:42:c0:a8:0c:fe), Dst: 02:42:c0:a8:0c:09 (02:42:c0:a8:0c:09)
Internet Protocol Version 4, Src: 192.168.11.109, Dst: 192.168.12.9
Transmission Control Protocol, Src Port: 5684, Dst Port: 51038, Seq: 0, Ack: 1, Len: 0

No.     Time           Source                Destination           Protocol Length Info
      3 0.000111047    192.168.12.9          192.168.11.109        TCP      66     51038 → 5684 [ACK] Seq=1 Ack=1 Win=64256 Len=0 TSval=2352695904 TSecr=3413488918

Frame 3: 66 bytes on wire (528 bits), 66 bytes captured (528 bits) on interface eth1, id 0
Ethernet II, Src: 02:42:c0:a8:0c:09 (02:42:c0:a8:0c:09), Dst: 02:42:c0:a8:0c:fe (02:42:c0:a8:0c:fe)
Internet Protocol Version 4, Src: 192.168.12.9, Dst: 192.168.11.109
Transmission Control Protocol, Src Port: 51038, Dst Port: 5684, Seq: 1, Ack: 1, Len: 0

No.     Time           Source                Destination           Protocol Length Info
      4 0.000156158    192.168.12.9          192.168.11.109        TLSv1.3  568    Client Hello

Frame 4: 568 bytes on wire (4544 bits), 568 bytes captured (4544 bits) on interface eth1, id 0
Ethernet II, Src: 02:42:c0:a8:0c:09 (02:42:c0:a8:0c:09), Dst: 02:42:c0:a8:0c:fe (02:42:c0:a8:0c:fe)
Internet Protocol Version 4, Src: 192.168.12.9, Dst: 192.168.11.109
Transmission Control Protocol, Src Port: 51038, Dst Port: 5684, Seq: 1, Ack: 1, Len: 502
Transport Layer Security

No.     Time           Source                Destination           Protocol Length Info
      5 0.000163032    192.168.11.109        192.168.12.9          TCP      66     5684 → 51038 [ACK] Seq=1 Ack=503 Win=64768 Len=0 TSval=3413488918 TSecr=2352695904

Frame 5: 66 bytes on wire (528 bits), 66 bytes captured (528 bits) on interface eth1, id 0
Ethernet II, Src: 02:42:c0:a8:0c:fe (02:42:c0:a8:0c:fe), Dst: 02:42:c0:a8:0c:09 (02:42:c0:a8:0c:09)
Internet Protocol Version 4, Src: 192.168.11.109, Dst: 192.168.12.9
Transmission Control Protocol, Src Port: 5684, Dst Port: 51038, Seq: 1, Ack: 503, Len: 0

No.     Time           Source                Destination           Protocol Length Info
      6 0.001103756    192.168.11.109        192.168.12.9          TLSv1.3  194    Server Hello

Frame 6: 194 bytes on wire (1552 bits), 194 bytes captured (1552 bits) on interface eth1, id 0
Ethernet II, Src: 02:42:c0:a8:0c:fe (02:42:c0:a8:0c:fe), Dst: 02:42:c0:a8:0c:09 (02:42:c0:a8:0c:09)
Internet Protocol Version 4, Src: 192.168.11.109, Dst: 192.168.12.9
Transmission Control Protocol, Src Port: 5684, Dst Port: 51038, Seq: 1, Ack: 503, Len: 128
Transport Layer Security

No.     Time           Source                Destination           Protocol Length Info
      7 0.001128001    192.168.12.9          192.168.11.109        TCP      66     51038 → 5684 [ACK] Seq=503 Ack=129 Win=64128 Len=0 TSval=2352695905 TSecr=3413488919

Frame 7: 66 bytes on wire (528 bits), 66 bytes captured (528 bits) on interface eth1, id 0
Ethernet II, Src: 02:42:c0:a8:0c:09 (02:42:c0:a8:0c:09), Dst: 02:42:c0:a8:0c:fe (02:42:c0:a8:0c:fe)
Internet Protocol Version 4, Src: 192.168.12.9, Dst: 192.168.11.109
Transmission Control Protocol, Src Port: 51038, Dst Port: 5684, Seq: 503, Ack: 129, Len: 0

No.     Time           Source                Destination           Protocol Length Info
      8 0.002017032    192.168.11.109        192.168.12.9          TLSv1.3  94     Application Data

Frame 8: 94 bytes on wire (752 bits), 94 bytes captured (752 bits) on interface eth1, id 0
Ethernet II, Src: 02:42:c0:a8:0c:fe (02:42:c0:a8:0c:fe), Dst: 02:42:c0:a8:0c:09 (02:42:c0:a8:0c:09)
Internet Protocol Version 4, Src: 192.168.11.109, Dst: 192.168.12.9
Transmission Control Protocol, Src Port: 5684, Dst Port: 51038, Seq: 129, Ack: 503, Len: 28
Transport Layer Security

No.     Time           Source                Destination           Protocol Length Info
      9 0.002033555    192.168.12.9          192.168.11.109        TCP      66     51038 → 5684 [ACK] Seq=503 Ack=157 Win=64128 Len=0 TSval=2352695906 TSecr=3413488920

Frame 9: 66 bytes on wire (528 bits), 66 bytes captured (528 bits) on interface eth1, id 0
Ethernet II, Src: 02:42:c0:a8:0c:09 (02:42:c0:a8:0c:09), Dst: 02:42:c0:a8:0c:fe (02:42:c0:a8:0c:fe)
Internet Protocol Version 4, Src: 192.168.12.9, Dst: 192.168.11.109
Transmission Control Protocol, Src Port: 51038, Dst Port: 5684, Seq: 503, Ack: 157, Len: 0

No.     Time           Source                Destination           Protocol Length Info
     10 0.002095913    192.168.11.109        192.168.12.9          TLSv1.3  2649   Application Data

Frame 10: 2649 bytes on wire (21192 bits), 2649 bytes captured (21192 bits) on interface eth1, id 0
Ethernet II, Src: 02:42:c0:a8:0c:fe (02:42:c0:a8:0c:fe), Dst: 02:42:c0:a8:0c:09 (02:42:c0:a8:0c:09)
Internet Protocol Version 4, Src: 192.168.11.109, Dst: 192.168.12.9
Transmission Control Protocol, Src Port: 5684, Dst Port: 51038, Seq: 157, Ack: 503, Len: 2583
Transport Layer Security

No.     Time           Source                Destination           Protocol Length Info
     11 0.002111907    192.168.12.9          192.168.11.109        TCP      66     51038 → 5684 [ACK] Seq=503 Ack=2740 Win=63616 Len=0 TSval=2352695906 TSecr=3413488920

Frame 11: 66 bytes on wire (528 bits), 66 bytes captured (528 bits) on interface eth1, id 0
Ethernet II, Src: 02:42:c0:a8:0c:09 (02:42:c0:a8:0c:09), Dst: 02:42:c0:a8:0c:fe (02:42:c0:a8:0c:fe)
Internet Protocol Version 4, Src: 192.168.12.9, Dst: 192.168.11.109
Transmission Control Protocol, Src Port: 51038, Dst Port: 5684, Seq: 503, Ack: 2740, Len: 0

No.     Time           Source                Destination           Protocol Length Info
     12 0.005394522    192.168.11.109        192.168.12.9          TLSv1.3  352    Application Data

Frame 12: 352 bytes on wire (2816 bits), 352 bytes captured (2816 bits) on interface eth1, id 0
Ethernet II, Src: 02:42:c0:a8:0c:fe (02:42:c0:a8:0c:fe), Dst: 02:42:c0:a8:0c:09 (02:42:c0:a8:0c:09)
Internet Protocol Version 4, Src: 192.168.11.109, Dst: 192.168.12.9
Transmission Control Protocol, Src Port: 5684, Dst Port: 51038, Seq: 2740, Ack: 503, Len: 286
Transport Layer Security

No.     Time           Source                Destination           Protocol Length Info
     13 0.005417318    192.168.12.9          192.168.11.109        TCP      66     51038 → 5684 [ACK] Seq=503 Ack=3026 Win=64128 Len=0 TSval=2352695910 TSecr=3413488924

Frame 13: 66 bytes on wire (528 bits), 66 bytes captured (528 bits) on interface eth1, id 0
Ethernet II, Src: 02:42:c0:a8:0c:09 (02:42:c0:a8:0c:09), Dst: 02:42:c0:a8:0c:fe (02:42:c0:a8:0c:fe)
Internet Protocol Version 4, Src: 192.168.12.9, Dst: 192.168.11.109
Transmission Control Protocol, Src Port: 51038, Dst Port: 5684, Seq: 503, Ack: 3026, Len: 0

No.     Time           Source                Destination           Protocol Length Info
     14 0.005456839    192.168.11.109        192.168.12.9          TLSv1.3  124    Application Data

Frame 14: 124 bytes on wire (992 bits), 124 bytes captured (992 bits) on interface eth1, id 0
Ethernet II, Src: 02:42:c0:a8:0c:fe (02:42:c0:a8:0c:fe), Dst: 02:42:c0:a8:0c:09 (02:42:c0:a8:0c:09)
Internet Protocol Version 4, Src: 192.168.11.109, Dst: 192.168.12.9
Transmission Control Protocol, Src Port: 5684, Dst Port: 51038, Seq: 3026, Ack: 503, Len: 58
Transport Layer Security

No.     Time           Source                Destination           Protocol Length Info
     15 0.005460386    192.168.12.9          192.168.11.109        TCP      66     51038 → 5684 [ACK] Seq=503 Ack=3084 Win=64128 Len=0 TSval=2352695910 TSecr=3413488924

Frame 15: 66 bytes on wire (528 bits), 66 bytes captured (528 bits) on interface eth1, id 0
Ethernet II, Src: 02:42:c0:a8:0c:09 (02:42:c0:a8:0c:09), Dst: 02:42:c0:a8:0c:fe (02:42:c0:a8:0c:fe)
Internet Protocol Version 4, Src: 192.168.12.9, Dst: 192.168.11.109
Transmission Control Protocol, Src Port: 51038, Dst Port: 5684, Seq: 503, Ack: 3084, Len: 0

No.     Time           Source                Destination           Protocol Length Info
     16 0.005550922    192.168.12.9          192.168.11.109        TLSv1.3  124    Application Data

Frame 16: 124 bytes on wire (992 bits), 124 bytes captured (992 bits) on interface eth1, id 0
Ethernet II, Src: 02:42:c0:a8:0c:09 (02:42:c0:a8:0c:09), Dst: 02:42:c0:a8:0c:fe (02:42:c0:a8:0c:fe)
Internet Protocol Version 4, Src: 192.168.12.9, Dst: 192.168.11.109
Transmission Control Protocol, Src Port: 51038, Dst Port: 5684, Seq: 503, Ack: 3084, Len: 58
Transport Layer Security

No.     Time           Source                Destination           Protocol Length Info
     17 0.005575938    192.168.11.109        192.168.12.9          TCP      66     5684 → 51038 [ACK] Seq=3084 Ack=561 Win=64768 Len=0 TSval=3413488924 TSecr=2352695910

Frame 17: 66 bytes on wire (528 bits), 66 bytes captured (528 bits) on interface eth1, id 0
Ethernet II, Src: 02:42:c0:a8:0c:fe (02:42:c0:a8:0c:fe), Dst: 02:42:c0:a8:0c:09 (02:42:c0:a8:0c:09)
Internet Protocol Version 4, Src: 192.168.11.109, Dst: 192.168.12.9
Transmission Control Protocol, Src Port: 5684, Dst Port: 51038, Seq: 3084, Ack: 561, Len: 0

No.     Time           Source                Destination           Protocol Length Info
     18 0.005618156    192.168.12.9          192.168.11.109        TLSv1.3  102    Application Data

Frame 18: 102 bytes on wire (816 bits), 102 bytes captured (816 bits) on interface eth1, id 0
Ethernet II, Src: 02:42:c0:a8:0c:09 (02:42:c0:a8:0c:09), Dst: 02:42:c0:a8:0c:fe (02:42:c0:a8:0c:fe)
Internet Protocol Version 4, Src: 192.168.12.9, Dst: 192.168.11.109
Transmission Control Protocol, Src Port: 51038, Dst Port: 5684, Seq: 561, Ack: 3084, Len: 36
Transport Layer Security

No.     Time           Source                Destination           Protocol Length Info
     19 0.005636909    192.168.11.109        192.168.12.9          TCP      66     5684 → 51038 [ACK] Seq=3084 Ack=597 Win=64768 Len=0 TSval=3413488924 TSecr=2352695910

Frame 19: 66 bytes on wire (528 bits), 66 bytes captured (528 bits) on interface eth1, id 0
Ethernet II, Src: 02:42:c0:a8:0c:fe (02:42:c0:a8:0c:fe), Dst: 02:42:c0:a8:0c:09 (02:42:c0:a8:0c:09)
Internet Protocol Version 4, Src: 192.168.11.109, Dst: 192.168.12.9
Transmission Control Protocol, Src Port: 5684, Dst Port: 51038, Seq: 3084, Ack: 597, Len: 0

No.     Time           Source                Destination           Protocol Length Info
     20 0.005653037    192.168.11.109        192.168.12.9          TLSv1.3  102    Application Data

Frame 20: 102 bytes on wire (816 bits), 102 bytes captured (816 bits) on interface eth1, id 0
Ethernet II, Src: 02:42:c0:a8:0c:fe (02:42:c0:a8:0c:fe), Dst: 02:42:c0:a8:0c:09 (02:42:c0:a8:0c:09)
Internet Protocol Version 4, Src: 192.168.11.109, Dst: 192.168.12.9
Transmission Control Protocol, Src Port: 5684, Dst Port: 51038, Seq: 3084, Ack: 597, Len: 36
Transport Layer Security

No.     Time           Source                Destination           Protocol Length Info
     21 0.005674458    192.168.12.9          192.168.11.109        TCP      66     51038 → 5684 [ACK] Seq=597 Ack=3120 Win=64128 Len=0 TSval=2352695910 TSecr=3413488924

Frame 21: 66 bytes on wire (528 bits), 66 bytes captured (528 bits) on interface eth1, id 0
Ethernet II, Src: 02:42:c0:a8:0c:09 (02:42:c0:a8:0c:09), Dst: 02:42:c0:a8:0c:fe (02:42:c0:a8:0c:fe)
Internet Protocol Version 4, Src: 192.168.12.9, Dst: 192.168.11.109
Transmission Control Protocol, Src Port: 51038, Dst Port: 5684, Seq: 597, Ack: 3120, Len: 0

No.     Time           Source                Destination           Protocol Length Info
     22 0.005714084    192.168.12.9          192.168.11.109        TLSv1.3  90     Application Data

Frame 22: 90 bytes on wire (720 bits), 90 bytes captured (720 bits) on interface eth1, id 0
Ethernet II, Src: 02:42:c0:a8:0c:09 (02:42:c0:a8:0c:09), Dst: 02:42:c0:a8:0c:fe (02:42:c0:a8:0c:fe)
Internet Protocol Version 4, Src: 192.168.12.9, Dst: 192.168.11.109
Transmission Control Protocol, Src Port: 51038, Dst Port: 5684, Seq: 597, Ack: 3120, Len: 24
Transport Layer Security

No.     Time           Source                Destination           Protocol Length Info
     23 0.005729883    192.168.11.109        192.168.12.9          TCP      66     5684 → 51038 [ACK] Seq=3120 Ack=621 Win=64768 Len=0 TSval=3413488924 TSecr=2352695910

Frame 23: 66 bytes on wire (528 bits), 66 bytes captured (528 bits) on interface eth1, id 0
Ethernet II, Src: 02:42:c0:a8:0c:fe (02:42:c0:a8:0c:fe), Dst: 02:42:c0:a8:0c:09 (02:42:c0:a8:0c:09)
Internet Protocol Version 4, Src: 192.168.11.109, Dst: 192.168.12.9
Transmission Control Protocol, Src Port: 5684, Dst Port: 51038, Seq: 3120, Ack: 621, Len: 0

No.     Time           Source                Destination           Protocol Length Info
     24 0.005752420    192.168.12.9          192.168.11.109        TCP      66     51038 → 5684 [FIN, ACK] Seq=621 Ack=3120 Win=64128 Len=0 TSval=2352695910 TSecr=3413488924

Frame 24: 66 bytes on wire (528 bits), 66 bytes captured (528 bits) on interface eth1, id 0
Ethernet II, Src: 02:42:c0:a8:0c:09 (02:42:c0:a8:0c:09), Dst: 02:42:c0:a8:0c:fe (02:42:c0:a8:0c:fe)
Internet Protocol Version 4, Src: 192.168.12.9, Dst: 192.168.11.109
Transmission Control Protocol, Src Port: 51038, Dst Port: 5684, Seq: 621, Ack: 3120, Len: 0

No.     Time           Source                Destination           Protocol Length Info
     25 0.005766122    192.168.11.109        192.168.12.9          TLSv1.3  90     Application Data

Frame 25: 90 bytes on wire (720 bits), 90 bytes captured (720 bits) on interface eth1, id 0
Ethernet II, Src: 02:42:c0:a8:0c:fe (02:42:c0:a8:0c:fe), Dst: 02:42:c0:a8:0c:09 (02:42:c0:a8:0c:09)
Internet Protocol Version 4, Src: 192.168.11.109, Dst: 192.168.12.9
Transmission Control Protocol, Src Port: 5684, Dst Port: 51038, Seq: 3120, Ack: 622, Len: 24
Transport Layer Security

No.     Time           Source                Destination           Protocol Length Info
     26 0.005782013    192.168.12.9          192.168.11.109        TCP      54     51038 → 5684 [RST] Seq=622 Win=0 Len=0

Frame 26: 54 bytes on wire (432 bits), 54 bytes captured (432 bits) on interface eth1, id 0
Ethernet II, Src: 02:42:c0:a8:0c:09 (02:42:c0:a8:0c:09), Dst: 02:42:c0:a8:0c:fe (02:42:c0:a8:0c:fe)
Internet Protocol Version 4, Src: 192.168.12.9, Dst: 192.168.11.109
Transmission Control Protocol, Src Port: 51038, Dst Port: 5684, Seq: 622, Len: 0
